{
  "$schema": "https://json-schema.org/draft/2020-12/schema",
  "$id": "https://omca.dev/schemas/protocol/generation.v1alpha1.schema.json",
  "title": "Generation v1alpha1",
  "description": "Maps the Desired Graph to native artifacts in one immutable runtime (docs/architecture/README.md §5.4, Generation Graph, and §8, Runtime and State Layout: ~/.local/state/omca/worktrees/<worktree-id>/generations/<generation-id>/). A generation is a build output, never a desired-state source (docs/ontology/README.md §1.1, runtime_generation).",
  "type": "object",
  "additionalProperties": false,
  "required": ["apiVersion", "kind", "metadata", "spec"],
  "properties": {
    "apiVersion": { "$ref": "common.v1alpha1.schema.json#/$defs/apiVersion" },
    "kind": { "const": "Generation" },
    "metadata": {
      "type": "object",
      "additionalProperties": false,
      "required": ["id", "worktree", "createdAt"],
      "properties": {
        "id": { "type": "string", "minLength": 1 },
        "worktree": { "type": "string", "minLength": 1 },
        "invocation": {
          "type": "string",
          "description": "Additive v1alpha1 field (issue #18, PR-14): free-text description of what triggered this generation to be compiled, e.g. 'omca run codex'. Optional; a bootstrap generation (PR-09) always omits it."
        },
        "parent": {
          "type": ["string", "null"],
          "description": "Previous generation ID this one supersedes, or null for the bootstrap generation."
        },
        "createdAt": { "type": "string" }
      }
    },
    "spec": {
      "type": "object",
      "additionalProperties": false,
      "required": ["desiredGraphDigest", "knowledgePacks", "hosts"],
      "properties": {
        "desiredGraphDigest": { "$ref": "common.v1alpha1.schema.json#/$defs/digest" },
        "knowledgePacks": {
          "type": "array",
          "description": "docs/knowledge/README.md §11: every generation stores the Pack itself or a durable content-addressed copy.",
          "items": {
            "type": "object",
            "additionalProperties": false,
            "required": ["id", "digest"],
            "properties": {
              "id": { "type": "string", "minLength": 1 },
              "digest": { "$ref": "common.v1alpha1.schema.json#/$defs/digest" }
            }
          }
        },
        "hosts": {
          "type": "object",
          "description": "hostId -> per-host compiled artifact tree, each edge carrying Adapter ID, mapping relation, and ownership (docs/architecture/README.md §5.4).",
          "propertyNames": { "$ref": "common.v1alpha1.schema.json#/$defs/hostId" },
          "additionalProperties": {
            "type": "object",
            "additionalProperties": false,
            "required": ["surface", "adapterId", "ownership"],
            "properties": {
              "surface": { "type": "string" },
              "adapterId": { "type": "string", "minLength": 1 },
              "adapterVersion": { "type": "string" },
              "hostVersion": { "type": "string", "minLength": 1 },
              "ownership": { "$ref": "common.v1alpha1.schema.json#/$defs/ownership" },
              "artifacts": {
                "type": "array",
                "items": {
                  "type": "object",
                  "additionalProperties": false,
                  "required": ["path", "digest"],
                  "properties": {
                    "path": { "type": "string", "minLength": 1 },
                    "digest": { "$ref": "common.v1alpha1.schema.json#/$defs/digest" }
                  }
                }
              }
            }
          }
        },
        "status": {
          "type": "string",
          "description": "Not a closed protocol-wide enum: pending/current/superseded/rolledback are Reconciler/Ledger states (docs/architecture/README.md §9 Reconciler, §4 Ledger), tracked here for convenience only.",
          "enum": ["pending", "current", "superseded", "rolledback"]
        },
        "sources": {
          "type": "array",
          "description": "Additive v1alpha1 field (issue #13, PR-09): every observed source a compiler included or excluded when building this generation, and why (docs/architecture/runtime.md §12: 'native exclusions are explained rather than hidden'). A capabilityGap:true entry may omit source/scope (a class-level gap, not tied to one discovered path) but must carry a non-empty trackingIssue -- capability-gap shipping is allowed, hiding is not.",
          "items": {
            "type": "object",
            "additionalProperties": false,
            "required": ["concept", "included", "reason"],
            "properties": {
              "concept": { "type": "string", "minLength": 1 },
              "source": { "type": "string" },
              "scope": { "type": "string" },
              "host": {
                "type": "string",
                "description": "Additive v1alpha1 field (issue #19, PR-15): which host this entry's decision belongs to, for a Generation whose spec.hosts names more than one host. Empty for a genuinely host-neutral entry."
              },
              "included": { "type": "boolean" },
              "reason": { "type": "string", "minLength": 1 },
              "capabilityGap": { "type": "boolean" },
              "trackingIssue": {
                "type": "string",
                "minLength": 1,
                "description": "Required and non-empty when capabilityGap is true (capability-gap shipping is allowed, hiding is not)."
              }
            },
            "if": { "properties": { "capabilityGap": { "const": true } } },
            "then": { "required": ["capabilityGap", "trackingIssue"] }
          }
        },
        "ontologyVersion": {
          "type": "string",
          "description": "Additive v1alpha1 field (issue #18, PR-14): the docs/ontology/README.md vocabulary revision this generation's Concept/Scope/Intent values were compiled under (internal/domain.CurrentOntologyVersion)."
        },
        "sourceDigest": {
          "description": "Additive v1alpha1 field (issue #18, PR-14): canonical digest over spec.sources, the 'source... digest' half of docs/architecture/runtime.md §5.3's 'source and desired-state digests' pending-manifest line.",
          "oneOf": [{ "$ref": "common.v1alpha1.schema.json#/$defs/digest" }, { "const": "" }]
        },
        "desiredState": {
          "type": "object",
          "description": "Additive v1alpha1 field (issue #18, PR-14): names the exact Profile/Activation/Exception documents desiredGraphDigest was computed from -- §5.3's 'selected Profiles and Activation'. Nil/omitted on a bootstrap generation (PR-09), which has no real Desired Graph.",
          "additionalProperties": false,
          "properties": {
            "profiles": {
              "type": "array",
              "items": {
                "type": "object",
                "additionalProperties": false,
                "required": ["id", "digest"],
                "properties": {
                  "id": { "type": "string", "minLength": 1 },
                  "digest": { "$ref": "common.v1alpha1.schema.json#/$defs/digest" }
                }
              }
            },
            "activation": {
              "oneOf": [{ "$ref": "common.v1alpha1.schema.json#/$defs/digest" }, { "const": "" }]
            },
            "exceptions": {
              "type": "array",
              "items": { "$ref": "common.v1alpha1.schema.json#/$defs/digest" }
            }
          }
        },
        "diff": {
          "type": "object",
          "description": "Reserved for §5.3's 'native/current/pending diff' line. Always omitted in this PR (issue #18, PR-14) -- a real diff requires the Activation transaction, PR-15 scope.",
          "additionalProperties": false,
          "properties": {
            "nativeChanged": { "type": "array", "items": { "type": "string" } },
            "currentChanged": { "type": "array", "items": { "type": "string" } }
          }
        },
        "riskConfirmations": {
          "type": "array",
          "description": "Reserved for §5.3's 'risk confirmations' line. Always empty in this PR (issue #18, PR-14) -- no risk-confirmation workflow exists yet to source real values from.",
          "items": { "type": "string" }
        },
        "expectedEvidence": {
          "type": "array",
          "description": "Reserved for §5.3's 'expected evidence and guarantee' line. Always empty in this PR (issue #18, PR-14) -- a real expectation needs the Verify step and its evidence taxonomy, PR-22 scope.",
          "items": {
            "type": "object",
            "additionalProperties": false,
            "required": ["host"],
            "properties": {
              "host": { "$ref": "common.v1alpha1.schema.json#/$defs/hostId" },
              "evidence": { "type": "string" },
              "guarantee": { "type": "string" }
            }
          }
        }
      }
    }
  }
}
